logged_at,offer_id,item_name,mcat_name,price,specs_category_outlier_status,specs_category_outlier_reason,title_category_outlier_status,title_category_outlier_reason,photo_category_outlier_status,photo_category_outlier_reason,photo_title_verdict,photo_title_verdict_reason,title_spec_verdict,title_spec_verdict_reason,price_flag_verdict,price_flag_reason,retail_classification,retail_classi_score,retail_confidence,retail_override_applied,retail_reason,retail_raw_json,retail_error,price_agent_result,price_agent_score,price_agent_confidence,price_value_by_ai,price_agent_reason,price_raw_json,price_error
2026-05-07 17:47:16,143862012195,Kids Toys,A4 Size Paper,0,not_outlier,The product specifications mentioning 'Paper Density: 75 GSM' are consistent with the category 'A4 Size Paper'.,not_outlier,The product title 'Kids Toys' is not an outlier for the category 'A4 Size Paper' because paper can be used for kids' crafts and toys.,outlier,The primary object 'blank paper sheets' is not an outlier for the category 'A4 Size Paper' as paper is the core product.,not_outlier,"The primary object 'blank paper sheets' is consistent with the product title 'Kids Toys', as paper can be used for various children's activities.",outlier,"The product title 'Kids Toys' contradicts the product specifications related to paper quantity and density, which are business-oriented.",outlier,Unit Absurd,NON-RETAIL,0.8,High,No,2000 boxes far exceed typical retail shop stock; quantity signals bulk/industrial purchase despite neutral category.,"{""Display_id"": 143862012195, ""Classification"": ""NON-RETAIL"", ""Classi_Score"": 0.8, ""Confidence"": ""High"", ""Override_Applied"": ""No"", ""Reason"": ""2000 boxes far exceed typical retail shop stock; quantity signals bulk/industrial purchase despite neutral category.""}",,Correct,1.0,Medium,₹ 1280000 - ₹ 1920000,"AI range overlaps buyer range and deviation 6.25%, so price is considered correct.","{""Display_id"": ""143862012195"", ""Price_Results"": ""Correct"", ""Price_Score"": 1.0, ""Confidence"": ""Medium"", ""Quantity"": ""2000 Box"", ""Qty_Normalized"": ""2000 BOX"", ""Price_Value"": ""Rs. 10 to 20 Lakh"", ""Price_Value_By_AI"": ""₹ 1280000 - ₹ 1920000"", ""Unit_Price_Used"": ""800.00"", ""Unit_Price_Logic"": ""Median price used; BL absent, so unit price = 800.00 INR"", ""BL_Data_Quality"": ""Weak"", ""BL_Items_Used"": [], ""Tolerance_Applied"": ""±20% — weak BL"", ""Deviation_Pct"": ""6.25%"", ""Price_Reason"": ""AI range overlaps buyer range and deviation 6.25%, so price is considered correct.""}",
2026-05-07 17:55:03,143878005913,Lime Bath Soap,Bath Soaps,0,not_outlier,The product specifications mentioning 'Dettol Original 100g' are consistent with the category 'Bath Soaps'.,not_outlier,The product title 'Lime Bath Soap' directly corresponds to the category 'Bath Soaps'.,not_outlier,The primary object 'soap bar' aligns with the category name 'Bath Soaps'.,not_outlier,,not_outlier,"The product title 'Lime Bath Soap' is consistent with the product specifications mentioning 'Brand: Dettol', 'Weight: 100 g', and 'Variant: Original'.",outlier,Price Absurd,RETAIL,0.8,High,No,"10-piece Bath Soaps order, retail‑oriented category, retailer purchases >60% indicating shop stock rather than bulk/industrial demand.","{""Display_id"": 143878005913, ""Classification"": ""RETAIL"", ""Classi_Score"": 0.8, ""Confidence"": ""High"", ""Override_Applied"": ""No"", ""Reason"": ""10-piece Bath Soaps order, retail‑oriented category, retailer purchases >60% indicating shop stock rather than bulk/industrial demand.""}",,Not-Correct,0.2,Medium,₹ 480 - ₹ 720,"Buyer range far below AI range; no overlap, high deviation","{""Display_id"": ""143878005913"", ""Price_Results"": ""Not-Correct"", ""Price_Score"": 0.2, ""Confidence"": ""Medium"", ""Quantity"": ""10 Piece"", ""Qty_Normalized"": ""10 PIECE"", ""Price_Value"": ""Rs. 100 - 300"", ""Price_Value_By_AI"": ""₹ 480 - ₹ 720"", ""Unit_Price_Used"": ""60.00"", ""Unit_Price_Logic"": ""Median used; BL weak discarded"", ""BL_Data_Quality"": ""Weak"", ""BL_Items_Used"": [], ""Tolerance_Applied"": ""±20% – BL weak"", ""Deviation_Pct"": ""66.67%"", ""Price_Reason"": ""Buyer range far below AI range; no overlap, high deviation""}",
2026-05-07 18:06:29,143862012195,Kids Toys,A4 Size Paper,0,not_outlier,Product specifications detailing paper quantity and density are consistent with the category 'A4 Size Paper'.,outlier,Product title 'Kids Toys' is completely unrelated to the category 'A4 Size Paper'.,outlier,"Primary object 'Stack of paper' is not aligned with the category name 'A4 Size Paper', as it's a different product type.",not_outlier,"Primary object 'Stack of paper' is consistent with the general idea of 'Kids Toys', but the product title is too generic.",outlier,Product title 'Kids Toys' contradicts product specifications detailing paper quantity and density.,outlier,Unit Absurd,NON-RETAIL,0.6,Medium,No,"2000 boxes of A4 paper far exceeds typical retail stock; quantity suggests wholesale purchase, leading to NON-RETAIL classification.","{""Display_id"": 143862012195, ""Classification"": ""NON-RETAIL"", ""Classi_Score"": 0.6, ""Confidence"": ""Medium"", ""Override_Applied"": ""No"", ""Reason"": ""2000 boxes of A4 paper far exceeds typical retail stock; quantity suggests wholesale purchase, leading to NON-RETAIL classification.""}",,Correct,1.0,Medium,"₹ 1,280,000 - ₹ 1,920,000","Buyer range overlaps AI range; deviation small, thus Correct","{""Display_id"": ""143862012195"", ""Price_Results"": ""Correct"", ""Price_Score"": 1.0, ""Confidence"": ""Medium"", ""Quantity"": ""2000 Box"", ""Qty_Normalized"": ""2000 BOX"", ""Price_Value"": ""Rs. 10 to 20 Lakh"", ""Price_Value_By_AI"": ""₹ 1,280,000 - ₹ 1,920,000"", ""Unit_Price_Used"": ""800.00"", ""Unit_Price_Logic"": ""Used Median price only; no BL data, unit price = ₹800.00"", ""BL_Data_Quality"": ""Absent"", ""BL_Items_Used"": [], ""Tolerance_Applied"": ""±20% – BL absent"", ""Deviation_Pct"": ""6.25%"", ""Price_Reason"": ""Buyer range overlaps AI range; deviation small, thus Correct""}",
2026-05-07 18:09:53,143862012195,Kids Toys,A4 Size Paper,0,outlier,"Product specifications indicate bulk paper for business use, which contradicts the 'A4 Size Paper' category.",not_outlier,The product title 'Kids Toys' is inconsistent with the category 'A4 Size Paper'.,outlier,The primary object 'Paper' is not directly aligned with the category 'A4 Size Paper' as the image does not show A4 size paper specifically.,not_outlier,"The primary object 'Paper' is consistent with the product title 'Kids Toys' as paper can be used in toys, but it's not a direct match.",not_outlier,The product title 'Kids Toys' is inconsistent with product specifications related to bulk paper purchase for business use.,outlier,Unit Absurd,NON-RETAIL,0.6,Medium,No,"2000 boxes far exceed typical retail stock; despite paper being retail‑oriented, quantity indicates wholesale/industrial purchase.","{""Display_id"": 143862012195, ""Classification"": ""NON-RETAIL"", ""Classi_Score"": 0.6, ""Confidence"": ""Medium"", ""Override_Applied"": ""No"", ""Reason"": ""2000 boxes far exceed typical retail stock; despite paper being retail‑oriented, quantity indicates wholesale/industrial purchase.""}",,Correct,1.0,Medium,"₹ 1,280,000 - ₹ 1,920,000","AI range overlaps buyer range; deviation small, verdict Correct","{""Display_id"": ""143862012195"", ""Price_Results"": ""Correct"", ""Price_Score"": 1.0, ""Confidence"": ""Medium"", ""Quantity"": ""2000 Box"", ""Qty_Normalized"": ""2000 BOX"", ""Price_Value"": ""Rs. 10 to 20 Lakh"", ""Price_Value_By_AI"": ""₹ 1,280,000 - ₹ 1,920,000"", ""Unit_Price_Used"": ""800.00"", ""Unit_Price_Logic"": ""Median used; BL weak, fallback to 800 per unit"", ""BL_Data_Quality"": ""Weak"", ""BL_Items_Used"": [], ""Tolerance_Applied"": ""±20% – BL weak"", ""Deviation_Pct"": ""6.25%"", ""Price_Reason"": ""AI range overlaps buyer range; deviation small, verdict Correct""}",
2026-05-07 18:15:08,143878327759,Ai Electric Cycle,Electric Bicycle,0,not_outlier,Product specifications mentioning range are consistent with the category name 'Electric Bicycle'.,not_outlier,The product title 'Ai Electric Cycle' aligns with the category name 'Electric Bicycle'.,not_outlier,The primary object 'electric bicycle' aligns with the category name 'Electric Bicycle'.,not_outlier,,not_outlier,The product title 'Ai Electric Cycle' is consistent with specifications mentioning range.,outlier,Price Absurd,UNCLASSIFIED,,None,,Classification skipped — Quantity is missing or invalid.,"{""Display_id"": 143878327759, ""Classification"": ""UNCLASSIFIED"", ""Classi_Score"": null, ""Confidence"": ""None"", ""Reason"": ""Classification skipped — Quantity is missing or invalid.""}",,Unverifiable,0.0,Low,,Missing Qty and Order_Value; cannot compute range,"{""Display_id"": ""143878327759"", ""Price_Results"": ""Unverifiable"", ""Price_Score"": 0.0, ""Confidence"": ""Low"", ""Quantity"": """", ""Qty_Normalized"": """", ""Price_Value"": """", ""Price_Value_By_AI"": """", ""Unit_Price_Used"": ""0"", ""Unit_Price_Logic"": ""Median only, no qty/unit"", ""BL_Data_Quality"": ""Absent"", ""BL_Items_Used"": [], ""Tolerance_Applied"": ""±20% – no BL data"", ""Deviation_Pct"": """", ""Price_Reason"": ""Missing Qty and Order_Value; cannot compute range""}",
2026-05-07 19:03:57,143878327759,Ai Electric Cycle,Electric Bicycle,0,not_outlier,Specifications like 'Range: 60 km' are relevant to products within the 'Electric Bicycle' category.,not_outlier,Product title 'Ai Electric Cycle' aligns with the category 'Electric Bicycle'.,not_outlier,Primary object 'electric bicycle' directly matches the category name 'Electric Bicycle'.,not_outlier,,not_outlier,Product title 'Ai Electric Cycle' is consistent with specifications related to range.,outlier,Price Absurd,UNCLASSIFIED,,None,,Classification skipped — Quantity is missing or invalid.,"{""Display_id"": 143878327759, ""Classification"": ""UNCLASSIFIED"", ""Classi_Score"": null, ""Confidence"": ""None"", ""Reason"": ""Classification skipped — Quantity is missing or invalid.""}",,Unverifiable,0.0,Low,,No reference price data; Qty and Order_Value missing,"{""Display_id"": ""143878327759"", ""Price_Results"": ""Unverifiable"", ""Price_Score"": 0.0, ""Confidence"": ""Low"", ""Quantity"": """", ""Qty_Normalized"": """", ""Price_Value"": """", ""Price_Value_By_AI"": """", ""Unit_Price_Used"": """", ""Unit_Price_Logic"": ""No median/Q3 data; cannot compute"", ""BL_Data_Quality"": ""Weak"", ""BL_Items_Used"": [], ""Tolerance_Applied"": """", ""Deviation_Pct"": """", ""Price_Reason"": ""No reference price data; Qty and Order_Value missing""}",
2026-05-07 19:06:02,143776160334,Clay Brick,Clay Brick,0,not_outlier,"The product specifications (quantity, dimensions) are relevant to items within the 'Clay Brick' category.",not_outlier,The product title 'Clay Brick' matches the category name 'Clay Brick'.,not_outlier,The primary object 'pile of clay bricks' directly corresponds to the category name 'Clay Brick'.,not_outlier,,not_outlier,The product title 'Clay Brick' is consistent with the product specifications listing quantity and dimensions.,outlier,Price Absurd,NON-RETAIL,1.0,High,Yes — Category-based override (Construction materials),"Category Clay Brick is construction material; always industrial trade, not retail resale.","{""Display_id"": 143776160334, ""Classification"": ""NON-RETAIL"", ""Classi_Score"": 1.0, ""Confidence"": ""High"", ""Override_Applied"": ""Yes — Category-based override (Construction materials)"", ""Reason"": ""Category Clay Brick is construction material; always industrial trade, not retail resale.""}",,Correct,0.8,Low,"₹ 10,679 - ₹ 13,052","Buyer budget lower; AI price 20% above but within 25% tolerance, so verdict Correct","{""Display_id"": ""143776160334"", ""Price_Results"": ""Correct"", ""Price_Score"": 0.8, ""Confidence"": ""Low"", ""Quantity"": ""1500 Piece"", ""Qty_Normalized"": ""1500 PIECE"", ""Price_Value"": ""Rs. 9,000 - 10,000"", ""Price_Value_By_AI"": ""₹ 10,679 - ₹ 13,052"", ""Unit_Price_Used"": ""7.91"", ""Unit_Price_Logic"": ""70% median +30% BL avg"", ""BL_Data_Quality"": ""Usable"", ""BL_Items_Used"": [""Red Clay Brick @ ₹6/Piece"", ""Awwal Eeta Bricks @ ₹8/Piece""], ""Tolerance_Applied"": ""±10% — tight cluster"", ""Deviation_Pct"": ""20%"", ""Price_Reason"": ""Buyer budget lower; AI price 20% above but within 25% tolerance, so verdict Correct""}",
